{
  "schema_version": "1.0",
  "receipt_id": "rcpt_2026_10_demo01",
  "subscription_id": "sub_demo_0001",
  "delivery_id": "del_demo_0001",
  "recipient_uid_hash": "sha256:aaaaaaaaaaaaaaaaaaaaaaaaaaaaaaaaaaaaaaaaaaaaaaaaaaaaaaaaaaaaaaaa",
  "asset": "PI",
  "amount": 10,
  "period": {
    "start": "2026-10-01",
    "end": "2026-10-31"
  },
  "delivered_at": "2026-10-02",
  "attestation_id": "att_2026_10_demo01",
  "status": "settled",
  "issuer_signature": {
    "scheme": "ed25519",
    "public_key": "aaaaaaaaaaaaaaaaaaaaaaaaaaaaaaaaaaaaaaaaaaaaaaaaaaaaaaaaaaaaaaaa",
    "value": "bbbbbbbbbbbbbbbbbbbbbbbbbbbbbbbbbbbbbbbbbbbbbbbbbbbbbbbbbbbbbbbbbbbbbbbbbbbbbbbbbbbbbbbbbbbbbbbbbbbbbbbbbbbbbbbbbbbbbbbbbbbbbb",
    "signed_at": "2026-10-02"
  },
  "created_at": "2026-10-02",
  "notes": "Synthetic example. The uid hash is not a real person."
}
